{
  "schema_version": "hti-capabilities-1",
  "candidate_version": "0.3-composable-operational-convergence.1",
  "kernel_api": "1",
  "modules": {
    "textual": {
      "version": "0.3-composable-rearchitecture-candidate.1",
      "kernel_api": "1",
      "may_publish": false,
      "operations": [
        "TRANSLATE",
        "SCHOLARLY_TRANSLATE",
        "TRANSCRIBE_DIPLOMATIC",
        "NORMALIZE_LATIN",
        "COMPARE_WITNESSES",
        "RECONSTRUCT_PAGE_ORDER",
        "ANALYZE_RARE_BOOK",
        "ANALYZE_MARGINALIA",
        "BUILD_SCRIPTURE_APPARATUS",
        "ANALYZE_ORIGINAL_LANGUAGE",
        "ANALYZE_EXEGETICAL_METHOD",
        "BUILD_PASTORAL_STUDY"
      ],
      "instructions": [
        "capabilities/textual/instructions.md",
        "references/translation-task.md",
        "references/typography-and-transcription.md",
        "references/image-processing.md",
        "references/scholar-view.md",
        "references/rare-book-evidence.md",
        "references/witnesses-and-collation.md",
        "references/scripture-and-original-languages.md",
        "references/pastoral-study.md"
      ],
      "contract": "registry/contracts/textual.json",
      "code_paths": [
        "scripts/collate.py",
        "scripts/image_tools.py",
        "scripts/search_witness.py"
      ]
    },
    "sources": {
      "version": "0.3-composable-rearchitecture-candidate.1",
      "kernel_api": "1",
      "may_publish": false,
      "operations": [
        "VERIFY_SOURCE",
        "IDENTIFY_WORK",
        "SEARCH_CROSS_WORK",
        "RENDER_CITATION_READY"
      ],
      "instructions": [
        "capabilities/sources/instructions.md",
        "references/sources-and-proposition-verification.md",
        "references/cross-work-research.md",
        "references/bibliographic-discovery.md",
        "references/citation.md"
      ],
      "contract": "registry/contracts/sources.json",
      "code_paths": []
    },
    "argument": {
      "version": "0.3-composable-rearchitecture-candidate.1",
      "kernel_api": "1",
      "may_publish": false,
      "operations": [
        "BUILD_ARGUMENT_DOSSIER",
        "DETECT_LOCUS"
      ],
      "instructions": [
        "capabilities/argument/instructions.md",
        "references/argument-architecture.md",
        "references/dependency-uncertainty.md",
        "references/loci-and-exegetical-method.md"
      ],
      "contract": "registry/contracts/argument.json",
      "code_paths": [
        "scripts/hti_core/argument_architecture.py",
        "scripts/hti_core/dependency_uncertainty.py"
      ]
    },
    "historical": {
      "version": "0.3-composable-rearchitecture-candidate.1",
      "kernel_api": "1",
      "may_publish": false,
      "operations": [
        "ASSESS_HISTORICAL_RELATION",
        "TRACE_LINEAGE",
        "ANALYZE_SOURCE_TRANSMISSION",
        "ADJUDICATE_IMMEDIATE_SOURCE",
        "ANALYZE_RECEPTION",
        "COMPARE_CONCEPTS"
      ],
      "instructions": [
        "capabilities/historical/instructions.md",
        "references/historical-relations.md",
        "references/lineage-traversal.md",
        "references/source-transmission-forensics.md",
        "references/reception-conceptual-history.md"
      ],
      "contract": "registry/contracts/historical.json",
      "code_paths": [
        "scripts/hti_core/historical_relations.py",
        "scripts/hti_core/lineage_engine.py",
        "scripts/hti_core/reception_history.py",
        "scripts/hti_core/source_transmission.py"
      ]
    },
    "confessional": {
      "version": "0.3-composable-rearchitecture-candidate.1",
      "kernel_api": "1",
      "may_publish": false,
      "operations": [
        "TRACE_CONFESSIONAL_LOCUS",
        "COMPARE_CONFESSIONAL_FORMULATIONS"
      ],
      "instructions": [
        "capabilities/confessional/instructions.md",
        "references/confessional-creedal-locus-tracing.md",
        "references/westminster-confessional-comparison.md"
      ],
      "contract": "registry/contracts/confessional.json",
      "code_paths": [
        "scripts/hti_core/confessional_registry.py"
      ]
    },
    "explanation": {
      "version": "0.3-composable-rearchitecture-candidate.1",
      "kernel_api": "1",
      "may_publish": false,
      "operations": [
        "RECONSTRUCT_INTERLOCUTOR",
        "ANALYZE_PRESSURE_FIELD"
      ],
      "instructions": [
        "capabilities/explanation/instructions.md",
        "references/historical-explanation.md"
      ],
      "contract": "registry/contracts/explanation.json",
      "code_paths": [
        "scripts/hti_core/historical_explanation.py"
      ]
    },
    "corpus": {
      "version": "0.3-composable-post-live-repair.1",
      "kernel_api": "1",
      "may_publish": false,
      "operations": [
        "MAP_WHOLE_WORK",
        "MAP_DEVELOPMENT",
        "COMPARE_WORK_MAPS",
        "ASSESS_NOVELTY",
        "ADJUDICATE_ORIGINALITY",
        "AUDIT_NOVELTY_LEDGER",
        "ASSESS_ACCESS_NETWORK",
        "TEST_HISTORICAL_SENSITIVITY"
      ],
      "instructions": [
        "capabilities/corpus/instructions.md",
        "references/cartography.md",
        "references/novelty.md",
        "references/historical-infrastructure-sensitivity.md"
      ],
      "contract": "registry/contracts/corpus.json",
      "code_paths": [
        "scripts/hti_core/cartography.py",
        "scripts/hti_core/historical_infrastructure.py",
        "scripts/hti_core/historical_sensitivity.py",
        "scripts/hti_core/novelty.py"
      ]
    },
    "library": {
      "version": "0.3-composable-rearchitecture-candidate.1",
      "kernel_api": "1",
      "may_publish": false,
      "operations": [
        "ONBOARD_SPECIALIZATION",
        "UPDATE_RESEARCH_STATE"
      ],
      "instructions": [
        "capabilities/library/instructions.md",
        "references/specialization-onboarding.md",
        "references/specialization-core.md",
        "references/licensed-resources.md",
        "references/research-state.md"
      ],
      "contract": "registry/contracts/library.json",
      "code_paths": [
        "scripts/hti_core/specialization_onboarding.py",
        "scripts/research_state.py",
        "scripts/specialization_core.py",
        "scripts/specialization_evidence.py",
        "scripts/specialization_resources.py",
        "scripts/specialization_storage.py"
      ]
    },
    "kernel": {
      "version": "0.3-composable-operational-convergence.1",
      "kernel_api": "1",
      "may_publish": true,
      "operations": [],
      "instructions": [
        "kernel/instructions.md",
        "references/core-workflow.md",
        "references/evidence-and-uncertainty.md",
        "references/source-representations.md",
        "references/proposition-integrity.md",
        "references/output-templates.md",
        "references/work-identification.md",
        "references/adversarial-controls.md",
        "references/natural-language-routing.md",
        "references/multilingual-generalization.md",
        "references/native-authoring.md"
      ],
      "contract": "registry/contracts/kernel.json",
      "code_paths": [
        "scripts/adapters/__init__.py",
        "scripts/adapters/v01_compat.py",
        "scripts/complete_commentary_task.py",
        "scripts/complete_scholar_view_task.py",
        "scripts/evidence_audit.py",
        "scripts/finalize_response.py",
        "scripts/hti_core/__init__.py",
        "scripts/hti_core/audit.py",
        "scripts/hti_core/completion.py",
        "scripts/hti_core/composition.py",
        "scripts/hti_core/hashing.py",
        "scripts/hti_core/manifest.py",
        "scripts/hti_core/model.py",
        "scripts/hti_core/multilingual.py",
        "scripts/hti_core/natural_language_routing.py",
        "scripts/hti_core/provenance.py",
        "scripts/hti_core/relations.py",
        "scripts/hti_core/source_identity.py",
        "scripts/hti_core/source_representation.py",
        "scripts/hti_core/uncertainty.py",
        "scripts/image_inspection.py",
        "scripts/source_integrity.py",
        "scripts/task_state.py",
        "scripts/terminal_output.py",
        "scripts/validate_skill.py",
        "scripts/validate_composition_package.py",
        "scripts/native_authoring.py"
      ]
    }
  },
  "state_objects": {
    "source_integrity": {
      "producer_module": "kernel",
      "path": "source-integrity.json",
      "schema_field": "schema_version",
      "versions": [
        "hti-source-integrity-1"
      ],
      "retained_ok": true,
      "retained_binding": [
        "exact_task_directory",
        "same_work_id",
        "sha256_snapshot",
        "schema_version",
        "producer_module",
        "producer_version",
        "currentness_validated"
      ]
    },
    "dossier": {
      "producer_module": "argument",
      "path": "hti-argument-dossier.json",
      "schema_field": "schema_version",
      "versions": [
        "1"
      ],
      "retained_ok": true,
      "retained_binding": [
        "exact_task_directory",
        "same_work_id",
        "sha256_snapshot",
        "schema_version",
        "producer_module",
        "producer_version",
        "currentness_validated"
      ]
    },
    "source_registry": {
      "producer_module": "argument",
      "path": "hti-source-registry.json",
      "schema_field": "schema_version",
      "versions": [
        "1"
      ],
      "retained_ok": true,
      "retained_binding": [
        "exact_task_directory",
        "same_work_id",
        "sha256_snapshot",
        "schema_version",
        "producer_module",
        "producer_version",
        "currentness_validated"
      ]
    },
    "hrg": {
      "producer_module": "historical",
      "path": "hti-historical-graph.json",
      "schema_field": "schema_version",
      "versions": [
        "1"
      ],
      "retained_ok": true,
      "retained_binding": [
        "exact_task_directory",
        "same_work_id",
        "sha256_snapshot",